,href,tags
0,https://99designs.hk/logo-design/contests/mars-stars-youtube-logo-1148971,Guaranteed Logo design Technology
1,https://99designs.hk/logo-design/contests/design-logo-incorporates-what-1148638,Guaranteed Logo design Cleaning & Maintenance
2,https://99designs.hk/logo-design/contests/motorcycle-vloging-channel-focused-harley-davidsons-1148548,Guaranteed Blind Logo design Internet
4,https://99designs.hk/logo-design/contests/design-logo-asian-physician-non-profit-seeking-equal-1148513,Guaranteed Logo design Community & Non-Profit
5,https://99designs.hk/logo-design/contests/papi-logo-1148497,Guaranteed Fast-tracked Logo design Restaurant
7,https://99designs.hk/logo-design/contests/iv-hydration-medspa-logo-simple-hint-luxury-1148363,Guaranteed Logo design Spa & Esthetics
9,https://99designs.hk/logo-design/contests/heirloom-furniture-life-1148272,Guaranteed Logo design Home Furnishing
10,https://99designs.hk/logo-design/contests/motor-racing-team-logo-refresh-1148258,Gold Guaranteed Fast-tracked Logo design Automotive
14,https://99designs.hk/logo-design/contests/logo-school-auction-1148176,Guaranteed Blind Logo design Education
15,https://99designs.hk/logo-design/contests/design-logo-individual-providing-aesthetic-services-open-designs-1148163,Guaranteed Blind Logo design Spa & Esthetics
20,https://99designs.hk/logo-design/contests/cr%C3%A9er-un-logo-pour-laboratoire-de-police-scientifique-1147959,Guaranteed Logo design
22,https://99designs.hk/logo-design/contests/wordmark-logo-personal-brand-1147925,Platinum Fast-tracked Logo design Business & Consulting
24,https://99designs.hk/logo-design/contests/precision-1147885,Guaranteed Logo design Construction
27,https://99designs.hk/logo-design/contests/field-trip-ii-1147792,Guaranteed Logo design Travel & Hotel
29,https://99designs.hk/logo-design/contests/logo-law-firm-compensation-personal-injury-1147725,Guaranteed Logo design Attorney & Law
67,https://99designs.hk/logo-design/contests/logo-project-builds-codes-crypto-market-1147661,Blind Fast-tracked Logo design Technology
74,https://99designs.hk/logo-design/contests/out-standing-eye-catching-logo-sure-ckd-1147621,Guaranteed Logo design Construction
82,https://99designs.hk/logo-design/contests/maggar-logo-website-1147539,Gold Guaranteed Logo design Business & Consulting
131,https://99designs.hk/logo-design/contests/design-logo-huge-safety-brand-1147163,Guaranteed Logo design Retail
134,https://99designs.hk/logo-design/contests/design-fun-logo-helps-people-show-banks-potential-1147136,Gold Guaranteed Logo design Technology
143,https://99designs.hk/logo-design/contests/classic-family-crest-1147051,Guaranteed Logo design
171,https://99designs.hk/logo-design/contests/professional-logo-sports-exercise-research-collaborative-use-medicine-1146878,Guaranteed Logo design Medical & Pharmaceutical
179,https://99designs.hk/logo-design/contests/sallie-seiy-1146791,Guaranteed Logo design Real Estate & Mortgage
186,https://99designs.hk/logo-design/contests/travel-app-logo-design-modern-events-entertainment-1146752,Guaranteed Fast-tracked Logo design Entertainment & The Arts
196,https://99designs.hk/logo-design/contests/logo-design-needed-jockey-silk-sewing-business-1146663,Guaranteed Logo design
243,https://99designs.hk/logo-design/contests/help-young-company-create-brand-targets-mind-blowing-1146404,Platinum Guaranteed Blind Logo design
251,https://99designs.hk/logo-design/contests/create-therapy-logo-help-people-heal-trauma-1146343,Guaranteed Logo design Medical & Pharmaceutical
260,https://99designs.hk/logo-design/contests/steven-lofaro-logo-1146289,Guaranteed Logo design Real Estate & Mortgage
262,https://99designs.hk/logo-design/contests/logo-personal-injury-firm-1146279,Guaranteed Logo design Attorney & Law
263,https://99designs.hk/logo-design/contests/design-sophisticated-logo-innovative-service-targeting-affluent-savvy-1146258,Guaranteed Logo design Accounting & Financial
266,https://99designs.hk/logo-design/contests/logo-soothing-products-1146249,Guaranteed Logo design Spa & Esthetics
280,https://99designs.hk/logo-design/contests/heartland-word-play-1146180,Guaranteed Logo design Environmental
310,https://99designs.hk/logo-design/contests/design-powerful-symbol-wave-critical-thinkers-1146042,Gold Guaranteed Logo design Entertainment & The Arts
315,https://99designs.hk/logo-design/contests/earn-bragging-rights-designing-logo-world-famous-cocktail-1146029,Guaranteed Logo design Food & Drink
326,https://99designs.hk/logo-design/contests/logo-design-brand-amazon-1145993,Guaranteed Logo design Retail
332,https://99designs.hk/logo-design/contests/custom-massage-therapy-logo-1145966,Guaranteed Logo design Spa & Esthetics
335,https://99designs.hk/logo-design/contests/logo-national-real-estate-brand-1145948,Guaranteed Logo design Real Estate & Mortgage
338,https://99designs.hk/logo-design/contests/design-clean-crisp-logo-cleaning-soft-washing-business-1145937,Guaranteed Logo design Cleaning & Maintenance
344,https://99designs.hk/logo-design/contests/restaurant-rooftop-lounge-1145920,Guaranteed Logo design Food & Drink
357,https://99designs.hk/logo-design/contests/chinese-english-logo-premium-frozen-dumpling-brand-berlin-1145851,Guaranteed Logo design Food & Drink
404,https://99designs.hk/logo-design/contests/cr%C3%A9er-un-logo-branch%C3%A9-pour-une-micro-cr%C3%A8che-1145663,Guaranteed Logo design Childcare
427,https://99designs.hk/logo-design/contests/logo-insurance-broker-1145549,Guaranteed Logo design Accounting & Financial
432,https://99designs.hk/logo-design/contests/larkham-group-logo-1145529,Guaranteed Logo design Real Estate & Mortgage
533,https://99designs.hk/logo-design/contests/design-logo-vibrant-mountain-beer-pub-1145103,Guaranteed Blind Logo design Bar & Nightclub
545,https://99designs.hk/logo-design/contests/bookkeeping-business-mgmt-trades-please-list-design-serving-1145033,Guaranteed Logo design Construction
